{
  "$schema": "https://json-schema.org/draft/2020-12/schema",
  "$id": "https://projectzero.example/schemas/v1/summary-batch-request.json",
  "title": "SummaryBatchRequest",
  "type": "object",
  "additionalProperties": false,
  "required": ["schemaVersion", "requestId", "baseRevision", "locale", "events"],
  "properties": {
    "schemaVersion": { "const": 1 },
    "requestId": { "type": "string", "format": "uuid" },
    "baseRevision": { "type": "integer", "minimum": 1 },
    "locale": { "type": "string", "pattern": "^[A-Za-z]{2,3}(-[A-Za-z0-9]{2,8})*$" },
    "events": {
      "type": "array", "minItems": 1, "maxItems": 50,
      "items": {
        "type": "object", "additionalProperties": false,
        "required": ["eventId", "kind", "redactedTitle", "redactedBody", "contentFingerprint"],
        "properties": {
          "eventId": { "type": "string", "format": "uuid" },
          "kind": { "enum": ["MESSAGE", "SOCIAL", "CALENDAR", "DELIVERY", "MEDIA", "SYSTEM", "OTHER"] },
          "redactedTitle": { "type": ["string", "null"], "maxLength": 160 },
          "redactedBody": { "type": ["string", "null"], "maxLength": 2000 },
          "contentFingerprint": { "type": "string", "pattern": "^[A-Za-z0-9_-]{43}$" }
        }
      }
    }
  }
}
